{
  "$schema": "http://json-schema.org/draft-07/schema#",
  "fileMatch": ["blazar-manifest.json", "custom-manifest.json"],
  "name": "blazar-manifest",
  "type": "object",
  "version": "1.0",
  "additionalProperties": false,
  "properties": {
    "$schema": {
      "type": "string"
    },
    "configs": {
      "type": "object",
      "description": "Application settings",
      "additionalProperties": false,
      "properties": {
        "env": {
          "type": "integer",
          "default": 1,
          "description": "Define current environment",
          "enum": [1, 2, 3]
        },
        "force_https": {
          "type": "boolean",
          "default": false,
          "description": "Set true to force https in production"
        },
        "force_www": {
          "type": "integer",
          "default": 0,
          "description": "Use www",
          "enum": [-1, 0, 1]
        },
        "max_img_width": {
          "type": "integer",
          "default": 1920,
          "description": "Max image width to upload and render"
        },
        "max_img_height": {
          "type": "integer",
          "default": 1080,
          "description": "Max image height to upload and render"
        },
        "max_upload_filesize": {
          "type": "string",
          "default": "10MB",
          "description": "Max filesize to upload"
        },
        "texts_dir": {
          "type": "string",
          "description": "Directory to texts files"
        },
        "logs_dir": {
          "type": "string",
          "description": "Directory to logs files"
        },
        "save_logs": {
          "type": "string",
          "default": "json",
          "enum": ["all", "json", "html", "none"]
        },
        "cors": {
          "type": ["string", "null"],
          "default": null,
          "description": "Enable cors for domain"
        },
        "view_render_mustache": {
          "type": "boolean",
          "default": false,
          "description": "Use mustache template as default in view render"
        },
        "console_url": {
          "type": "string",
          "default": "http://localhost:4000",
          "description": "URI to send logs",
          "format": "uri"
        }
      }
    },
    "data": {
      "type": "object",
      "description": "Application data"
    },
    "dbs": {
      "type": "object",
      "description": "Databases",
      "additionalProperties": {
        "$ref": "#/definitions/db"
      }
    },
    "map": {
      "$ref": "#/definitions/map_list"
    }
  },
  "definitions": {
    "db": {
      "type": "object",
      "additionalProperties": false,
      "required": ["host", "user", "pass", "db"],
      "properties": {
        "drive": {
          "type": "string",
          "default": "mysql"
        },
        "host": {
          "type": "string"
        },
        "user": {
          "type": "string"
        },
        "pass": {
          "type": "string"
        },
        "db": {
          "type": "string"
        },
        "port": {
          "type": "string"
        },
        "socket": {
          "type": "string"
        }
      }
    },
    "map_list": {
      "type": "object",
      "description": "",
      "minProperties": 1,
      "patternProperties": {
        "^[a-zA-Z0-9_-]*$": {
          "$ref": "#/definitions/map"
        }
      },
      "additionalProperties": false
    },
    "map": {
      "additionalProperties": true,
      "required": ["class"],
      "properties": {
        "class": {
          "type": "string",
          "description": ""
        },
        "sub": {
          "$ref": "#/definitions/map_list"
        }
      }
    }
  }
}