{
  "$schema": "../schema/blazar-schema.json",
  "configs": {
    "logs_dir": "../logs"
  },
  "data": {
  },
  "dbs": {
    "main_db": {
      "drive": "mysql",
      "host": "localhost",
      "user": "root",
      "pass": "",
      "db": "dbexample"
    }
  },
  "map": {
    "home": {
      "class": "TestApp\\Pages\\Home\\Home"
    },
    "pg_midias": {
      "class": "TestApp\\Pages\\Midias\\Midias"
    },
    "db": {
      "class": "TestApp\\Pages\\DB\\DB"
    },
    "singleapi": {
      "class": "TestApp\\SingleAPI\\SingleAPI"
    },
    "multiapi": {
      "class": "TestApp\\MultiAPI\\MultiAPI",
      "sub": {
        "teste1": {
          "class": "TestApp\\MultiAPI\\APIs\\Teste1"
        },
        "teste2": {
          "class": "TestApp\\MultiAPI\\APIs\\Teste2"
        }
      }
    },
    "midias": {
      "class": "TestApp\\Midias"
    }
  }
}