{
  "$schema": "../../src/schema/blazar-schema.json",
  "configs": {
    "force_https": false,
    "force_www": 0,
    "max_img_width": 1920,
    "max_img_height": 1080,
    "max_upload_filesize": "10MB",
    "logs_dir": "../logs",
    "cors": "*"
  },
  "data": {
  },
  "dbs": {
    "principal": {
      "drive": "mysql",
      "host": "localhost",
      "user": "",
      "pass": "",
      "db": ""
    }
  },
  "map": {
    "pages": {
      "class": "Application\\PageController",
      "sub": {
        "home": {
          "class": "Application\\Pages\\Home"
        },
        "page2": {
          "class": "Application\\Pages\\Page2"
        }
      }
    }
  }
}